{
  "current": "SAMSUNG-TFAB1-11-20-25- Live-3.xer",
  "files": {
    "SAMSUNG-TFAB1-11-20-25- Live-3.xer": {
      "date": "2025-11-20",
      "description": "Live schedule - November 20, 2025",
      "status": "current"
    },
    "SECAI Schedule update 10-17-22.xer": {
      "date": "2022-10-17",
      "description": "Schedule update October 17, 2022",
      "status": "archived"
    },
    "SECAI revised plan(DD 10.31.2022, revised FFU TO Nov. 30. 2023).xer": {
      "date": "2022-10-31",
      "description": "Schedule update October 31, 2022",
      "status": "archived"
    },
    "schedule update data date 10-31-22.xer": {
      "date": "2022-10-31",
      "description": "Schedule update October 31, 2022",
      "status": "archived"
    },
    "SECAI Updated Schedule (DD 10.31.2022, FFU TO 1.19.2024).xer": {
      "date": "2022-10-31",
      "description": "Schedule update October 31, 2022",
      "status": "archived"
    },
    "4. SECAI Updated Schedule Nov.22.2022.xer": {
      "date": "2022-11-22",
      "description": "Schedule update November 22, 2022",
      "status": "archived"
    },
    "Schedule update 12-19-22- Data date .xer": {
      "date": "2022-12-19",
      "description": "Schedule update December 19, 2022",
      "status": "archived"
    },
    "T1 Project-SECAI schedule update-20221219.xer": {
      "date": "2022-12-19",
      "description": "Schedule update December 19, 2022",
      "status": "archived"
    },
    "T1 Project-SECAI schedule update-20230129.xer": {
      "date": "2023-01-29",
      "description": "Schedule update January 29, 2023",
      "status": "archived"
    },
    "T1 Project-SECAI schedule update-20230212.xer": {
      "date": "2023-02-12",
      "description": "Schedule update February 12, 2023",
      "status": "archived"
    },
    "T1 Project-SECAI schedule update-20230226.xer": {
      "date": "2023-02-26",
      "description": "Schedule update February 26, 2023",
      "status": "archived"
    },
    "T1 Project-SECAI schedule update-20230312.xer": {
      "date": "2023-03-12",
      "description": "Schedule update March 12, 2023",
      "status": "archived"
    },
    "T1 Project-SECAI schedule update-20230326.xer": {
      "date": "2023-03-26",
      "description": "Schedule update March 26, 2023",
      "status": "archived"
    },
    "T1 Project-SECAI schedule update-20230409.xer": {
      "date": "2023-04-09",
      "description": "Schedule update April 09, 2023",
      "status": "archived"
    },
    "T1 Project-SECAI schedule update-20230423.xer": {
      "date": "2023-04-23",
      "description": "Schedule update April 23, 2023",
      "status": "archived"
    },
    "T1 Project-SECAI schedule update-20230507.xer": {
      "date": "2023-05-07",
      "description": "Schedule update May 07, 2023",
      "status": "archived"
    },
    "T1 Project-SECAI schedule update-20230521.xer": {
      "date": "2023-05-21",
      "description": "Schedule update May 21, 2023",
      "status": "archived"
    },
    "T1 Project-SECAI schedule update-20230604.xer": {
      "date": "2023-06-04",
      "description": "Schedule update June 04, 2023",
      "status": "archived"
    },
    "T1 Project-SECAI schedule update-20230618.xer": {
      "date": "2023-06-18",
      "description": "Schedule update June 18, 2023",
      "status": "archived"
    },
    "T1 Project-SECAI schedule update-20230702.xer": {
      "date": "2023-07-02",
      "description": "Schedule update July 02, 2023",
      "status": "archived"
    },
    "Taylor FAB1-SECAI Schedule update_data date 7-30-23.xer": {
      "date": "2023-07-30",
      "description": "Schedule update July 30, 2023",
      "status": "archived"
    },
    "Aug.11.2023 T-PJT Level.3 Schedule R0.0 (1).xer": {
      "date": "2023-08-11",
      "description": "Schedule update August 11, 2023",
      "status": "archived"
    },
    "T1 Project-SECAI schedule update-20230827.xer": {
      "date": "2023-08-27",
      "description": "Schedule update August 27, 2023",
      "status": "archived"
    },
    "T1 Project-SECAI schedule update-20230924.xer": {
      "date": "2023-09-24",
      "description": "Schedule update September 24, 2023",
      "status": "archived"
    },
    "T1 Project-SECAI Schedule update-Data Date 11.12.2023.xer": {
      "date": "2023-11-12",
      "description": "Schedule update November 12, 2023",
      "status": "archived"
    },
    "3. SECAI revised plan(FFU TO Nov. 30. 2023).xer": {
      "date": "2023-11-30",
      "description": "Schedule update November 30, 2023",
      "status": "archived"
    },
    "4. SECAI Original Schedule(FFU 11.30.2023).xer": {
      "date": "2023-11-30",
      "description": "Schedule update November 30, 2023",
      "status": "archived"
    },
    "3. SECAI Re-baseline(FFU 12.30.2023).xer": {
      "date": "2023-12-30",
      "description": "Schedule update December 30, 2023",
      "status": "archived"
    },
    "SECAI TAYLOR FAB1 1.12.24 SCHEDULE UPDATE.xer": {
      "date": "2024-01-12",
      "description": "Schedule update January 12, 2024",
      "status": "archived"
    },
    "T1 Project-SECAI Schedule Update-Data Date 02-09-2024.xer": {
      "date": "2024-02-09",
      "description": "Schedule update February 09, 2024",
      "status": "archived"
    },
    "T1 Project-SECAI Schedule Update Data Date 03-08-2024.xer": {
      "date": "2024-03-08",
      "description": "Schedule update March 08, 2024",
      "status": "archived"
    },
    "T1 Project -SECAI Schedule Update Data Date 04-05-2024.xer": {
      "date": "2024-04-05",
      "description": "Schedule update April 05, 2024",
      "status": "archived"
    },
    "T1 Project -SECAI Schedule Update Data Date 05-03-2024.xer": {
      "date": "2024-05-03",
      "description": "Schedule update May 03, 2024",
      "status": "archived"
    },
    "T1 Project -SECAI Schedule Update Data Date 05-31-2024.xer": {
      "date": "2024-05-31",
      "description": "Schedule update May 31, 2024",
      "status": "archived"
    },
    "T1 Project -SECAI Schedule Update Data Date 06-28-2024_r1.xer": {
      "date": "2024-06-28",
      "description": "Schedule update June 28, 2024",
      "status": "archived"
    },
    "T1 Project -SECAI Schedule Update Data Date 07-26-2024.xer": {
      "date": "2024-07-26",
      "description": "Schedule update July 26, 2024",
      "status": "archived"
    },
    "T1 Project -SECAI Schedule Update Data Date 08-23-2024.xer": {
      "date": "2024-08-23",
      "description": "Schedule update August 23, 2024",
      "status": "archived"
    },
    "T1 Project -SECAI Schedule Update Data Date 09-20-2024.xer": {
      "date": "2024-09-20",
      "description": "Schedule update September 20, 2024",
      "status": "archived"
    },
    "T1 Project-SECAI Schedule Update Data Date 10-18-2024.xer": {
      "date": "2024-10-18",
      "description": "Schedule update October 18, 2024",
      "status": "archived"
    },
    "T1 Project-SECAI Schedule Update Data Date 11-15-2024.xer": {
      "date": "2024-11-15",
      "description": "Schedule update November 15, 2024",
      "status": "archived"
    },
    "T1 Project-SECAI Schedule Update Data Date 12-13-2024.xer": {
      "date": "2024-12-13",
      "description": "Schedule update December 13, 2024",
      "status": "archived"
    },
    "T1 Project-SECAI Schedule Update Data Date 1-10-2025.xer": {
      "date": "2025-01-10",
      "description": "Schedule update January 10, 2025",
      "status": "archived"
    },
    "T1 Project-SECAI Schedule Update Data Date 2-7-2025.xer": {
      "date": "2025-02-07",
      "description": "Schedule update February 07, 2025",
      "status": "archived"
    },
    "T1 Project-SECAI Schedule Update Data Date 3-7-2025.xer": {
      "date": "2025-03-07",
      "description": "Schedule update March 07, 2025",
      "status": "archived"
    },
    "T1 Project-SECAI Schedule Update Data Date 4-4-2025.xer": {
      "date": "2025-04-04",
      "description": "Schedule update April 04, 2025",
      "status": "archived"
    },
    "T1 Project-SECAI Schedule Update Data Date 5-2-2025.xer": {
      "date": "2025-05-02",
      "description": "Schedule update May 02, 2025",
      "status": "archived"
    },
    "T1 Project-SECAI Schedule Update Data Date 5-30-2025.xer": {
      "date": "2025-05-30",
      "description": "Schedule update May 30, 2025",
      "status": "archived"
    },
    "T1 Project-SECAI Schedule Update Data Date 6-27-2025 (1).xer": {
      "date": "2025-06-27",
      "description": "Schedule update June 27, 2025",
      "status": "archived"
    },
    "YATES-T FAB1 schedule update - 6-04-23 - To SECAI.xer": {
      "date": "YYYY-MM-DD",
      "description": "TODO: Add description",
      "status": "archived"
    },
    "YATES-T FAB1 schedule update -DD 11-1-24 - To SECAI.xer": {
      "date": "YYYY-MM-DD",
      "description": "TODO: Add description",
      "status": "archived"
    },
    "YATES-T FAB1 schedule update - 9-20-24 - To SECAI.xer": {
      "date": "YYYY-MM-DD",
      "description": "TODO: Add description",
      "status": "archived"
    },
    "YATES-T FAB1 schedule update - 10-15-23 - To SECAI.xer": {
      "date": "YYYY-MM-DD",
      "description": "TODO: Add description",
      "status": "archived"
    },
    "YATES-T FAB1 schedule update - 12-31-23 - To SECAI.xer": {
      "date": "YYYY-MM-DD",
      "description": "TODO: Add description",
      "status": "archived"
    },
    "YATES-T FAB1 schedule - 5-22-23 - SECAI inputs updated.xer": {
      "date": "YYYY-MM-DD",
      "description": "TODO: Add description",
      "status": "archived"
    },
    "YATES-T FAB1 schedule update - 10-04-23 - To SECAI.xer": {
      "date": "YYYY-MM-DD",
      "description": "TODO: Add description",
      "status": "archived"
    },
    "YATES-T FAB1 schedule update - 07-02-25 - To SECAI.xer": {
      "date": "YYYY-MM-DD",
      "description": "TODO: Add description",
      "status": "archived"
    },
    "YATES-T FAB1 schedule update - 12-31-23 - To SECAI - DRAFT.xer": {
      "date": "YYYY-MM-DD",
      "description": "TODO: Add description",
      "status": "archived"
    },
    "YATES-T FAB1 schedule - 11-22-22 - To SECAI.xer": {
      "date": "YYYY-MM-DD",
      "description": "TODO: Add description",
      "status": "archived"
    },
    "YATES-T FAB1 schedule - 12-5-22 - SECAI inputs updated.xer": {
      "date": "YYYY-MM-DD",
      "description": "TODO: Add description",
      "status": "archived"
    },
    "YATES-T FAB1 schedule update - DD 10-17-25 - To SECAI (1).xer": {
      "date": "YYYY-MM-DD",
      "description": "TODO: Add description",
      "status": "archived"
    },
    "YATES-T FAB1 schedule update - 12-10-23 - To SECAI.xer": {
      "date": "YYYY-MM-DD",
      "description": "TODO: Add description",
      "status": "archived"
    },
    "YATES-T FAB1 schedule update - 10-18-24 - To SECAI.xer": {
      "date": "YYYY-MM-DD",
      "description": "TODO: Add description",
      "status": "archived"
    },
    "YATES-T FAB1 schedule update - 11.29.24 - To SECAI.xer": {
      "date": "YYYY-MM-DD",
      "description": "TODO: Add description",
      "status": "archived"
    },
    "YATES-T FAB1 schedule update - 10-29-23 - To SECAI.xer": {
      "date": "YYYY-MM-DD",
      "description": "TODO: Add description",
      "status": "archived"
    },
    "YATES-T FAB1 schedule update - DD 10-31-25 - To SECAI (2).xer": {
      "date": "YYYY-MM-DD",
      "description": "TODO: Add description",
      "status": "archived"
    },
    "YATES-T FAB1 Study schedule update - 12-26-22 - To SECAI.xer": {
      "date": "YYYY-MM-DD",
      "description": "TODO: Add description",
      "status": "archived"
    },
    "YATES-T FAB1 schedule update - 08-20-23 - To SECAI.xer": {
      "date": "YYYY-MM-DD",
      "description": "TODO: Add description",
      "status": "archived"
    },
    "YATES-T FAB1 schedule update - 02-04-24 - To SECAI.xer": {
      "date": "YYYY-MM-DD",
      "description": "TODO: Add description",
      "status": "archived"
    },
    "YATES-T FAB1 schedule update - 04-08-24 - To SECAI.xer": {
      "date": "YYYY-MM-DD",
      "description": "TODO: Add description",
      "status": "archived"
    },
    "YATES-T FAB1 schedule - 06-18-23.xer": {
      "date": "YYYY-MM-DD",
      "description": "TODO: Add description",
      "status": "archived"
    },
    "YATES-T FAB1 schedule update - 2-09-24 - To SECAI.xer": {
      "date": "YYYY-MM-DD",
      "description": "TODO: Add description",
      "status": "archived"
    },
    "YATES-T FAB1 schedule update - 10-01-23 - To SECAI.xer": {
      "date": "YYYY-MM-DD",
      "description": "TODO: Add description",
      "status": "archived"
    },
    "YATES-T FAB1 schedule update - 1-24-25 - To SECAI.xer": {
      "date": "YYYY-MM-DD",
      "description": "TODO: Add description",
      "status": "archived"
    },
    "YATES-T FAB1 schedule update - 09-15-23 - To SECAI.xer": {
      "date": "YYYY-MM-DD",
      "description": "TODO: Add description",
      "status": "archived"
    },
    "YATES-T FAB1 schedule update - 3-28-25 - To SECAI.xer": {
      "date": "YYYY-MM-DD",
      "description": "TODO: Add description",
      "status": "archived"
    },
    "YATES-T FAB1 schedule update - 4-23-23 - To SECAI.xer": {
      "date": "YYYY-MM-DD",
      "description": "TODO: Add description",
      "status": "archived"
    },
    "YATES-T FAB1 schedule - 10-10-22 - To SECAI.xer": {
      "date": "YYYY-MM-DD",
      "description": "TODO: Add description",
      "status": "archived"
    },
    "YATES-T FAB1 schedule update - 060625 To SECAI.xer": {
      "date": "YYYY-MM-DD",
      "description": "TODO: Add description",
      "status": "archived"
    },
    "YATES-T FAB1 schedule - 6-28-24 - To SECAI.xer": {
      "date": "YYYY-MM-DD",
      "description": "TODO: Add description",
      "status": "archived"
    },
    "YATES-T FAB1 schedule update 5-07-23 - To SECAI.xer": {
      "date": "YYYY-MM-DD",
      "description": "TODO: Add description",
      "status": "archived"
    },
    "YATES-T FAB1 schedule update - 09-03-23 - To SECAI.xer": {
      "date": "YYYY-MM-DD",
      "description": "TODO: Add description",
      "status": "archived"
    },
    "YATES-T FAB1 schedule update - 12-27-24 - To SECAI.xer": {
      "date": "YYYY-MM-DD",
      "description": "TODO: Add description",
      "status": "archived"
    },
    "YATES-T FAB1 schedule update - 05-23-25 - To SECAI.xer": {
      "date": "YYYY-MM-DD",
      "description": "TODO: Add description",
      "status": "archived"
    },
    "YATES-T FAB1 schedule update - 10-03-25 - To SECAI.xer": {
      "date": "YYYY-MM-DD",
      "description": "TODO: Add description",
      "status": "archived"
    },
    "YATES-T FAB1 schedule - 12-5-22 - SECAI inputs updated (1).xer": {
      "date": "YYYY-MM-DD",
      "description": "TODO: Add description",
      "status": "archived"
    },
    "YATES-T FAB1 schedule update - 2-07-25 - To SECAI.xer": {
      "date": "YYYY-MM-DD",
      "description": "TODO: Add description",
      "status": "archived"
    },
    "YATES-T FAB1 schedule update - 1-10-25 - To SECAI.xer": {
      "date": "YYYY-MM-DD",
      "description": "TODO: Add description",
      "status": "archived"
    },
    "YATES-T FAB1 schedule update -DD 08-09-24 - To SECAI.xer": {
      "date": "YYYY-MM-DD",
      "description": "TODO: Add description",
      "status": "archived"
    },
    "YATES-T FAB1 schedule update - 08-23-24 - To SECAI.xer": {
      "date": "YYYY-MM-DD",
      "description": "TODO: Add description",
      "status": "archived"
    },
    "YATES-T FAB1 schedule update - 4-09-23 - To SECAI.xer": {
      "date": "YYYY-MM-DD",
      "description": "TODO: Add description",
      "status": "archived"
    },
    "YATES-T FAB1 schedule update - 12-13-24 - To SECAI.xer": {
      "date": "YYYY-MM-DD",
      "description": "TODO: Add description",
      "status": "archived"
    },
    "YATES-T FAB1 schedule update - 08-22-25 - To SECAI.xer": {
      "date": "YYYY-MM-DD",
      "description": "TODO: Add description",
      "status": "archived"
    },
    "YATES-T FAB1 schedule - 6-14-24 - To SECAI.xer": {
      "date": "YYYY-MM-DD",
      "description": "TODO: Add description",
      "status": "archived"
    },
    "YATES-T FAB1 schedule update - 7-16-23 - To SECAI.xer": {
      "date": "YYYY-MM-DD",
      "description": "TODO: Add description",
      "status": "archived"
    },
    "YATES-T FAB1 schedule - 11-07-22 - To SECAI.xer": {
      "date": "YYYY-MM-DD",
      "description": "TODO: Add description",
      "status": "archived"
    },
    "YATES-T FAB1 schedule - 1-09-23 - To SECAI.xer": {
      "date": "YYYY-MM-DD",
      "description": "TODO: Add description",
      "status": "archived"
    },
    "YATES-T FAB1 schedule update - 3-26-23 - To SECAI.xer": {
      "date": "YYYY-MM-DD",
      "description": "TODO: Add description",
      "status": "archived"
    },
    "YATES-T FAB1 schedule update - 3-22-23 - To SECAI.xer": {
      "date": "YYYY-MM-DD",
      "description": "TODO: Add description",
      "status": "archived"
    },
    "YATES-T FAB1 schedule update - 11-26-2023 - To SECAI.xer": {
      "date": "YYYY-MM-DD",
      "description": "TODO: Add description",
      "status": "archived"
    },
    "YATES-T FAB1 schedule update - 01-30-23 - To SECAI.xer": {
      "date": "YYYY-MM-DD",
      "description": "TODO: Add description",
      "status": "archived"
    },
    "YATES-T FAB1 schedule update - 04-04-25 - To SECAI.xer": {
      "date": "YYYY-MM-DD",
      "description": "TODO: Add description",
      "status": "archived"
    },
    "YATES-T FAB1 schedule update - 01-21-24 - To SECAI.xer": {
      "date": "YYYY-MM-DD",
      "description": "TODO: Add description",
      "status": "archived"
    },
    "YATES-T FAB1 Study Accelerated schedule -1-18-23 - Not Confirmed.xer": {
      "date": "YYYY-MM-DD",
      "description": "TODO: Add description",
      "status": "archived"
    },
    "YATES-T FAB1 schedule - 5-31-24 - To SECAI.xer": {
      "date": "YYYY-MM-DD",
      "description": "TODO: Add description",
      "status": "archived"
    },
    "YATES-T FAB1 schedule update - 4-09-23 - To SECAI (1).xer": {
      "date": "YYYY-MM-DD",
      "description": "TODO: Add description",
      "status": "archived"
    },
    "YATES-T FAB1 schedule update - DD 10-17-25 - To SECAI.xer": {
      "date": "YYYY-MM-DD",
      "description": "TODO: Add description",
      "status": "archived"
    },
    "YATES-T FAB1 schedule update - 07-18-25 - To SECAI.xer": {
      "date": "YYYY-MM-DD",
      "description": "TODO: Add description",
      "status": "archived"
    },
    "YATES-T FAB1 schedule update - 2-21-25 - To SECAI.xer": {
      "date": "YYYY-MM-DD",
      "description": "TODO: Add description",
      "status": "archived"
    },
    "YATES-T FAB1 schedule - 10-17-22 - To SECAI.xer": {
      "date": "YYYY-MM-DD",
      "description": "TODO: Add description",
      "status": "archived"
    },
    "YATES-T FAB1 schedule - 4-19-23 - To SECAI.xer": {
      "date": "YYYY-MM-DD",
      "description": "TODO: Add description",
      "status": "archived"
    },
    "YATES-T FAB1 schedule update - 05-02-25 - To SECAI.xer": {
      "date": "YYYY-MM-DD",
      "description": "TODO: Add description",
      "status": "archived"
    },
    "YATES-T FAB1 schedule - 12-07-22 - To SECAI.xer": {
      "date": "YYYY-MM-DD",
      "description": "TODO: Add description",
      "status": "archived"
    },
    "YATES-T FAB1 schedule - 10-21-22 - To SECAI.xer": {
      "date": "YYYY-MM-DD",
      "description": "TODO: Add description",
      "status": "archived"
    }
  }
}
